{
  "schemaVersion": "benchmark-execution-manifest/v1",
  "releaseId": "hc-cortex-002-release-20260901-r2",
  "releaseStatus": "VERIFIED",
  "generatedAt": "2026-09-01T21:03:38.433Z",
  "immutabilityPolicy": {
    "scheme": "sha256+bytes+manifest/v1",
    "osWriteProtectionClaimed": false,
    "externalBinding": "validation-snapshot"
  },
  "protocol": {
    "path": "protocol.json",
    "sha256": "4173b962962fc0b726ad4d0d9b5e3ade6918cdce1c00051ab939ac75693d6143",
    "sourceRegistration": {
      "repository": "https://github.com/cdeust/harness-comparison.git",
      "revision": "baecc89fea4062e99cba01b53a7a1797361ebeac",
      "path": "protocols/2026-08-30-hc-cortex-002-v1.json"
    }
  },
  "environment": {
    "repositories": [
      {
        "id": "harness-comparison",
        "repository": "https://github.com/cdeust/harness-comparison.git",
        "revision": "baecc89fea4062e99cba01b53a7a1797361ebeac",
        "dirty": false,
        "dirtyPaths": []
      },
      {
        "id": "cortex-baseline",
        "repository": "https://github.com/cdeust/Cortex.git",
        "revision": "8f5ae3b87b6969f3abcb3736859febfdab69304a",
        "dirty": false,
        "dirtyPaths": []
      },
      {
        "id": "cortex-candidate",
        "repository": "https://github.com/cdeust/Cortex.git",
        "revision": "9faa80d3f36b1c7fd05edb4aca8202448a79fb27",
        "dirty": false,
        "dirtyPaths": []
      }
    ],
    "host": {
      "os": "darwin",
      "release": "25.6.0",
      "architecture": "arm64",
      "cpu": "Apple M4",
      "logicalCpus": 10,
      "memoryBytes": 25769803776
    },
    "runtimes": [
      {
        "id": "python-3.12",
        "version": "Python 3.12.11; sha256=d049fa6d31f8075e3fcb76517ddaaa666fc2344768d6e7698d3263f79b49db8f"
      }
    ],
    "tools": [
      {
        "id": "workload-ladder-runner",
        "version": "sha256=496345f3bd146a1cfde8fcc127c33c38abe770e11557436312a8188a2901acdb"
      },
      {
        "id": "hc-cortex-002-independent-analyzer",
        "version": "hc-cortex-002-analysis/v1"
      }
    ],
    "credentials": [],
    "stores": [
      {
        "id": "regression-baseline-sqlite-c2",
        "type": "sqlite",
        "location": "cells/0001/database/cortex.sqlite3",
        "isolation": "fresh database dedicated to one cell",
        "initialState": "empty database checked by workload preflight"
      },
      {
        "id": "regression-candidate-sqlite-c2",
        "type": "sqlite",
        "location": "cells/0002/database/cortex.sqlite3",
        "isolation": "fresh database dedicated to one cell",
        "initialState": "empty database checked by workload preflight"
      },
      {
        "id": "main-r1-sqlite-c1",
        "type": "sqlite",
        "location": "cells/0003/database/cortex.sqlite3",
        "isolation": "fresh database dedicated to one cell",
        "initialState": "empty database checked by workload preflight"
      },
      {
        "id": "main-r1-sqlite-c2",
        "type": "sqlite",
        "location": "cells/0004/database/cortex.sqlite3",
        "isolation": "fresh database dedicated to one cell",
        "initialState": "empty database checked by workload preflight"
      },
      {
        "id": "main-r1-sqlite-c4",
        "type": "sqlite",
        "location": "cells/0005/database/cortex.sqlite3",
        "isolation": "fresh database dedicated to one cell",
        "initialState": "empty database checked by workload preflight"
      },
      {
        "id": "main-r1-sqlite-c5",
        "type": "sqlite",
        "location": "cells/0006/database/cortex.sqlite3",
        "isolation": "fresh database dedicated to one cell",
        "initialState": "empty database checked by workload preflight"
      },
      {
        "id": "main-r1-postgresql-c1",
        "type": "postgresql",
        "location": "redacted-database-identity:1254d2ff48843ae5229bb38a5b8caf2c8221fc9f9600e30fd234a802cfaab8d5",
        "isolation": "fresh database dedicated to one cell",
        "initialState": "empty database checked by workload preflight"
      },
      {
        "id": "main-r1-postgresql-c2",
        "type": "postgresql",
        "location": "redacted-database-identity:b7998497aef1f54830eaba177688bad400e135cf43812ae88fc116b134170cf2",
        "isolation": "fresh database dedicated to one cell",
        "initialState": "empty database checked by workload preflight"
      },
      {
        "id": "main-r1-postgresql-c4",
        "type": "postgresql",
        "location": "redacted-database-identity:a532825d5e2919d108a8857a48c7b6837d0d4f92e1c5df4e387712ccb70ab37e",
        "isolation": "fresh database dedicated to one cell",
        "initialState": "empty database checked by workload preflight"
      },
      {
        "id": "main-r1-postgresql-c5",
        "type": "postgresql",
        "location": "redacted-database-identity:a244318150706e139b5b05f5675cbd6fce8c71c2096d7b9abad8e3ed6cbfea0c",
        "isolation": "fresh database dedicated to one cell",
        "initialState": "empty database checked by workload preflight"
      },
      {
        "id": "main-r2-postgresql-c1",
        "type": "postgresql",
        "location": "redacted-database-identity:7316155a5c0c1245ccaee87b791422eaec11db35533ce78a5fc71ae1d4c949f2",
        "isolation": "fresh database dedicated to one cell",
        "initialState": "empty database checked by workload preflight"
      },
      {
        "id": "main-r2-postgresql-c2",
        "type": "postgresql",
        "location": "redacted-database-identity:dff5c3b3cc63ad330d8871f22469933e7c737e14cc20ead1742fcd11b45c02b9",
        "isolation": "fresh database dedicated to one cell",
        "initialState": "empty database checked by workload preflight"
      },
      {
        "id": "main-r2-postgresql-c4",
        "type": "postgresql",
        "location": "redacted-database-identity:8b47912968461a6f31a070d62cd6bd086508a2d90f376d93e8e4685161748543",
        "isolation": "fresh database dedicated to one cell",
        "initialState": "empty database checked by workload preflight"
      },
      {
        "id": "main-r2-postgresql-c5",
        "type": "postgresql",
        "location": "redacted-database-identity:5471faf30bf6119ffbd8cf101a5ec7101968ba2654dc675605fbf0f0a9d72b25",
        "isolation": "fresh database dedicated to one cell",
        "initialState": "empty database checked by workload preflight"
      },
      {
        "id": "main-r2-sqlite-c1",
        "type": "sqlite",
        "location": "cells/0015/database/cortex.sqlite3",
        "isolation": "fresh database dedicated to one cell",
        "initialState": "empty database checked by workload preflight"
      },
      {
        "id": "main-r2-sqlite-c2",
        "type": "sqlite",
        "location": "cells/0016/database/cortex.sqlite3",
        "isolation": "fresh database dedicated to one cell",
        "initialState": "empty database checked by workload preflight"
      },
      {
        "id": "main-r2-sqlite-c4",
        "type": "sqlite",
        "location": "cells/0017/database/cortex.sqlite3",
        "isolation": "fresh database dedicated to one cell",
        "initialState": "empty database checked by workload preflight"
      },
      {
        "id": "main-r2-sqlite-c5",
        "type": "sqlite",
        "location": "cells/0018/database/cortex.sqlite3",
        "isolation": "fresh database dedicated to one cell",
        "initialState": "empty database checked by workload preflight"
      }
    ],
    "processes": [
      {
        "id": "regression-baseline-sqlite-c2-workload",
        "instanceId": "a0554b75-39f4-4b06-b16e-6341b7ee45eb",
        "command": "python-3.12 hc-cortex-002-adapter workload",
        "pid": 54916,
        "host": "same-user local host; no operating-system sandbox claimed",
        "declaredEndpoints": []
      },
      {
        "id": "regression-baseline-sqlite-c2-oracle",
        "instanceId": "861120bf-bfe4-4d1e-8770-836da3cf3a00",
        "command": "python-3.12 hc-cortex-002-adapter oracle",
        "pid": 57739,
        "host": "same-user local host; no operating-system sandbox claimed",
        "declaredEndpoints": []
      },
      {
        "id": "regression-candidate-sqlite-c2-workload",
        "instanceId": "7d000e0e-0ec8-45f6-b7fb-1cd1bce0631c",
        "command": "python-3.12 hc-cortex-002-adapter workload",
        "pid": 64727,
        "host": "same-user local host; no operating-system sandbox claimed",
        "declaredEndpoints": []
      },
      {
        "id": "regression-candidate-sqlite-c2-oracle",
        "instanceId": "177c2370-861b-4b61-9b74-3c4a640103f3",
        "command": "python-3.12 hc-cortex-002-adapter oracle",
        "pid": 68303,
        "host": "same-user local host; no operating-system sandbox claimed",
        "declaredEndpoints": []
      },
      {
        "id": "main-r1-sqlite-c1-workload",
        "instanceId": "36b2b5b5-a5e5-4206-987b-579f1e50e6b2",
        "command": "python-3.12 hc-cortex-002-adapter workload",
        "pid": 75065,
        "host": "same-user local host; no operating-system sandbox claimed",
        "declaredEndpoints": []
      },
      {
        "id": "main-r1-sqlite-c1-oracle",
        "instanceId": "484dbfd4-29d8-4429-8dbb-1da98e3169ff",
        "command": "python-3.12 hc-cortex-002-adapter oracle",
        "pid": 79213,
        "host": "same-user local host; no operating-system sandbox claimed",
        "declaredEndpoints": []
      },
      {
        "id": "main-r1-sqlite-c2-workload",
        "instanceId": "1d5a43fb-28f6-47e8-8920-71cc1456f7e5",
        "command": "python-3.12 hc-cortex-002-adapter workload",
        "pid": 85362,
        "host": "same-user local host; no operating-system sandbox claimed",
        "declaredEndpoints": []
      },
      {
        "id": "main-r1-sqlite-c2-oracle",
        "instanceId": "0b0b1085-6495-4b58-86f1-aab6a121da67",
        "command": "python-3.12 hc-cortex-002-adapter oracle",
        "pid": 88745,